{
  "id": "rule_run_ends_close_reaction_window__example_1",
  "kind": "example",
  "number": "6.8.2b.ex1",
  "ref_type": "example",
  "title": null,
  "parent_id": "rule_run_ends_close_reaction_window",
  "child_ids": [],
  "text_markup": "The Runner uses the ability on {card:Security Nexus} during a reaction window at the beginning of the Encounter Ice Phase. The trace is successful, so the ability ends the run. If {card:Tollbooth}'s ability is also pending in this reaction window, it will not be resolved, since the encounter has ended.",
  "text_plain": "The Runner uses the ability on Security Nexus during a reaction window at the beginning of the Encounter Ice Phase. The trace is successful, so the ability ends the run. If Tollbooth's ability is also pending in this reaction window, it will not be resolved, since the encounter has ended.",
  "spans": [
    {
      "type": "card",
      "start": 31,
      "end": 45,
      "target": "Security Nexus",
      "card_code": "09047"
    },
    {
      "type": "card",
      "start": 173,
      "end": 182,
      "target": "Tollbooth",
      "card_code": "31066"
    }
  ],
  "examples": [],
  "is_new": false,
  "toc": false,
  "steps": false,
  "snippet_markup": null,
  "snippet_plain": null,
  "url": null
}
