{
  "id": "rule_card_types_with_play_costs",
  "kind": "rule",
  "number": "2.3.3",
  "ref_type": "rule",
  "title": null,
  "parent_id": "sec_printed_cost",
  "child_ids": [],
  "text_markup": "Events and operations have a play cost.",
  "text_plain": "Events and operations have a play cost.",
  "spans": [],
  "examples": [],
  "is_new": false,
  "toc": false,
  "steps": false,
  "snippet_markup": null,
  "snippet_plain": null,
  "url": "https://rules.nullsignal.games/?r=rule_card_types_with_play_costs"
}
