{
  "id": "sec_other_rules_and_terminology",
  "kind": "section",
  "number": "9.12",
  "ref_type": "section",
  "title": "Other Rules and Terminology",
  "parent_id": "chpt_abilities",
  "child_ids": [
    "subsec_simultaneous_effects",
    "subsec_quantities_and_sets",
    "subsec_must",
    "subsec_repeat_this_process",
    "subsec_persistent",
    "subsec_modal_abilities"
  ],
  "text_markup": "Other Rules and Terminology",
  "text_plain": "Other Rules and Terminology",
  "spans": [],
  "examples": [],
  "is_new": false,
  "toc": true,
  "steps": false,
  "snippet_markup": null,
  "snippet_plain": null,
  "url": "https://rules.nullsignal.games/?r=sec_other_rules_and_terminology"
}
