{
  "id": "rule_hand_inactive",
  "kind": "rule",
  "number": "4.3.5",
  "ref_type": "rule",
  "title": null,
  "parent_id": "sec_hand",
  "child_ids": [],
  "text_markup": "Cards in a hand are inactive.",
  "text_plain": "Cards in a hand are inactive.",
  "spans": [],
  "examples": [],
  "is_new": false,
  "toc": false,
  "steps": false,
  "snippet_markup": null,
  "snippet_plain": null,
  "url": "https://rules.nullsignal.games/?r=rule_hand_inactive"
}
