{
  "id": "rule_asset_rez_cost",
  "kind": "rule",
  "number": "3.3.2",
  "ref_type": "rule",
  "title": null,
  "parent_id": "sec_assets",
  "child_ids": [],
  "text_markup": "Assets are among the card types that have rez costs. They are installed unrezzed and remain inactive until the Corp rezzes them by paying their rez costs during a paid ability window. See {ref:sec_faceup_facedown_status}.",
  "text_plain": "Assets are among the card types that have rez costs. They are installed unrezzed and remain inactive until the Corp rezzes them by paying their rez costs during a paid ability window. See section 8.1.",
  "spans": [
    {
      "type": "ref",
      "start": 188,
      "end": 199,
      "ids": [
        "sec_faceup_facedown_status"
      ],
      "combiner": "and"
    }
  ],
  "examples": [],
  "is_new": false,
  "toc": false,
  "steps": false,
  "snippet_markup": null,
  "snippet_plain": null,
  "url": "https://rules.nullsignal.games/?r=rule_asset_rez_cost"
}
