{
  "id": "sec_appendix_timing_structure_of_a_run_6_d",
  "kind": "timing_structure",
  "number": "11.4_6_d",
  "ref_type": "appendix",
  "title": null,
  "parent_id": "sec_appendix_timing_structure_of_a_run_6",
  "child_ids": [],
  "text_markup": "The run is complete.",
  "text_plain": "The run is complete.",
  "spans": [],
  "examples": [],
  "is_new": false,
  "toc": false,
  "steps": false,
  "snippet_markup": null,
  "snippet_plain": null,
  "url": "https://rules.nullsignal.games/?r=sec_appendix_timing_structure_of_a_run_6_d"
}
