{
  "id": "rule_hosted_counter_used_condition__example_1",
  "kind": "example",
  "number": "9.1.6c.ex1",
  "ref_type": "example",
  "title": null,
  "parent_id": "rule_hosted_counter_used_condition",
  "child_ids": [],
  "text_markup": "The Runner spends the credit hosted on {card:Cyberfeeder} to pay the trigger cost of {card:Mimic}'s ability. Because the Runner triggered {card:Mimic}'s paid ability and {card:Cyberfeeder}'s ability allowed the credit to be spent, both {card:Mimic} and {card:Cyberfeeder} have been used.",
  "text_plain": "The Runner spends the credit hosted on Cyberfeeder to pay the trigger cost of Mimic's ability. Because the Runner triggered Mimic's paid ability and Cyberfeeder's ability allowed the credit to be spent, both Mimic and Cyberfeeder have been used.",
  "spans": [
    {
      "type": "card",
      "start": 39,
      "end": 50,
      "target": "Cyberfeeder",
      "card_code": "20006"
    },
    {
      "type": "card",
      "start": 78,
      "end": 83,
      "target": "Mimic",
      "card_code": "31008"
    },
    {
      "type": "card",
      "start": 124,
      "end": 129,
      "target": "Mimic",
      "card_code": "31008"
    },
    {
      "type": "card",
      "start": 149,
      "end": 160,
      "target": "Cyberfeeder",
      "card_code": "20006"
    },
    {
      "type": "card",
      "start": 208,
      "end": 213,
      "target": "Mimic",
      "card_code": "31008"
    },
    {
      "type": "card",
      "start": 218,
      "end": 229,
      "target": "Cyberfeeder",
      "card_code": "20006"
    }
  ],
  "examples": [],
  "is_new": false,
  "toc": false,
  "steps": false,
  "snippet_markup": null,
  "snippet_plain": null,
  "url": null
}
